,mark,review_text,date
53,7," отдыхали кисловодске декабре 2018 года. поездка понравилась, климат очень приятный. нюанс которыми столкнулись, кому полезна эта информация.1)в кисловодске фирменный магазин кисловодского фарфора, находится ул. губина. купили фарфоровые вазы подарок, серии феникс. цена небольшой вазы 2950 руб. продавцы уверяли, магазин производителя цены самые низкие, везде дороже. скиду сделали 5% нехотя, наличный расчет, карте какую. следующий день уехали пятигорск бродвее, таком фирменном магазине, те самые вазы , цена 650 руб. дешевле! покупайте пятигорске !2)решили поехать экскурсию, эльбрус. посмотрели погоду, выбрали среду. рядом колоннадой стоят экскурсионные фирмы, подошли дарина. продавец экскурсий светлана очень любезна купили неё, внесли 50% предоплаты. нам сказали ждите вами свяжутся скажут номер автобуса заберут. прождали понедельник, вторник вечером стали звонить сами. нам отвечают, экскурсия не состоится причине не укомплектованности автобуса. попросили отправили другую экскурсию, т.к. четверг уезжаем домой, ответ, мин водах мало туристов не набираются группы. попросили передать другим экскурсионным фирмам, желающие поехать, нам ответили, кого заказов нет, ждите нового года, наплыва туристов. это шок ! придя себя, не теряя надежды попасть среду эльбрус, вторник вечером 20.00 нашли сайте фирму эдельвейс, позвонили туда, нам ответили, нет проблем, заберут удобном месте среду попадете эльбрус. автобус полный, экскурсия прошла отлично, нам очень понравилось! советую обходить стороной фирму дарина, т.к. можете легко не попасть запланированную экскурсию испортить настроение!а целом кмв нам очень понравились ! ", 29 декабря 2018
54,10," отлично провёл время души тела. детства влюблён прекрасный город. мне, мальчишке, выросшему жаркой ставропольской степи, не видевшему настоящего леса, всё понравилось городе. снимали мамой комнату время улице парковой, улицу находился великолепный парк, примерно километрах двух, находилось городское озеро. время мало интересовали достопримечательности, интересовался парками, покушать мороженного покататься аттракционах, ещё великолепный, недавно построенный кинотеатр россия . мамой заходили посмотреть дневные фильмы, сеансов платной поликлинике.уже зрелом возрасте, бывая друга гостях не удавалось детально ознакомиться великолепием городка году выпала возможность сделать это. получил путёвку санаторий колос решил, 18 курортных дней посвящу исследованию замечательных мест города.встретил кисловодск небольшим дождиком, это не редкость июне, не понятно почему кисловодск называют городом-солнца? ехал жд санатория такси. пути увидел недавно отреставрированную колоннаду обрадовался её нынешним видом, последнее моё посещение начале нулевых, представляла жалкое зрелище.приняли санатории радушием. немного отдохнув номере разобрав вещи, моим соседом отправились ужином попить нарзану нарзанную галерею погулять курортному парку. увидеть колоннаду поближе сделали небольшой круг вошли парк неё. вблизи выглядит ещё краше, вид парка отсюда просто восхитителен. нарзанная галерея предстала нашему взору всём великолепии, внутри блистая стерильной чистотой. попив отправились зеркальному пруду. всё время делал прошлые свои посещения парка, существует поверие, нужно бросить несколько монет пруд, отдых удался. вообще-то курортный парк слишком большой это настоящая сокровищница достопримечательностей кисловодска познакомиться ними всеми просто не мыслимо несколько часов дней.на следующие выходные намечено поездка канатной дороге её осуществили, расскажу раз. ", 16 августа 2017
55,10," очень хочу побывать там. добрый день! хочу поделиться своими впечатлениями отдыхе кисловодске. мужем отдыхали санатории имени димитрова втором корпусе. принципе санатория остались приятные впечатления. конечно, не пять звезд, вполне прилично. хорошо, санатория свой бювет не нарзан, славяновская, желающих подлечить желудок немаловажно. кисловодск все-таки курорт не желудочников, тех, хочет поправить систему кровообращения. этому способствует огромный, шикарный парк. октябре, сожалению, долине роз отцвело, таком состоянии производит самое приятное впечатление. верхней площадки парка, которую добраться воздушном трамвайчике, не хотите идти пешком, хорошую погоду увидеть снежные шапки эльбруса, нам, кстати, удалось сфотографировать. же, нарзан. организм, измученный нарзаном (ильф петров) прекрасно чувствует целый год принятых ванн. это две основные достопримечательности кисловодска. каскадная лестница, например. около 200 ступенек (сама считала), хорошая тренировка сердца сосудов. любители экскурсий могут съездить эльбрус, близлежащие города пятигорск лермонтовским местам, железноводск, ессентуки. ", 06 июня 2017
56,10," насыщенный активный отдых городов кавказских минвод железноводск самым спортивным . да, курортный парк не блещет благоустроенностью, кое-что разрушается, равно очень красивый (остатки былой роскоши ), пешеходные тропы горы - терренкуры - надо! ходили-бродили целый день. накачали ноги, устали сожгли кучу калорий, наверное. итоге уставшие, очень довольные. виды вершины горы развалка (на фото) стоит. общем, мои рекомендации: 1) обязательно подняться вершину горы развалка устроить пикник; 2) дойти пещеры вечной мерзлоты; 3) дойти пещеры первобытного человека; 4) прогуляться курортному парку. железноводске 2 раза, небо немного затянуто облаками и, моему превеликому сожалению, вершину эльбруса не увидела. кстати, не любите не можете каким-то причинам долго гулять пешком, путь вышеуказанных пещер сократить: именно подняться гору автомобиле (навигатор помощь). ", 15 мая 2017
57,8," будете кисловодске - обязательно посетите песчаная гора кольцо расположена подъезде кисловодску. пару лет назад трудом нашла это место, году указатели, и, конечно, помог навигатор. ехать сюда стоит только, нет дождя - подъем кольцо довольно экстремальный даже, нет осадков (можно легко подскользнуться). подножия висит надпись: подниматься подходить близко горе строго запрещено - дело том, периодически хрупкий песчаник обваливается. это останавливало нашего человека?)) самые наблюдательные найдут грунте останки древних окаменелостей. хотя, конечно, большая часть холмика утоптана многочисленными туристами. горы открывается красивый вид окрестности.впечатления омрачают многочисленные наскальные надписи , сожалению, не древних людей, вполне современных. не лень им... кстати, подножия горы мини-рыночек местными сувенирами. практически все: магнитиков меховых ковров. цены здесь, всему курорту, примерно одинаковые. ", 12 мая 2017
58,7," реально мерзлота )) начала небольшое пояснение: грот вечной мерзлоты рядышком - пещера. это разных места. грот ничем не примечателен (расщелина скале). рекомендую посетить именно пещеру.ориентиры того, проще найти мерзлоту - кафе избушка лесника . сюда добраться, машине навигатору (а чуть-чуть пройти гору), пешочком пешеходной тропе терренкуру прямо железноводска (в случае прогулка одну сторону займет часа 2-3).пещера представляет тоннель метров 300, которого, действительно, идет холод. поэтому летом, жару, желаете исследовать глубины, запаситесь теплой одеждой (хотя кофта длинным рукавом). туристы редко доходят конца, обследовали весь тоннель - конце сужается. принципе интересного не наблюдали, поэтому просто зайти несколько метров вглубь не заморачиваться . и, кстати, найти пещеру, придется немножко попотеть : указатели не доводят самого места, шли практически наугад, пока не встретили других туристов. ", 12 мая 2017
59,8," обязательно посещения пятигорске озеро провал осмотреть двух сторон - главного входа, пройдя небольшой тоннель, забравшись гору сверху. первый вариант - традиционный, сказать, семейный, второй - экстремальный (провал - провал: грунт осыпается, ходить небезопасно).само озеро провал очень небольшое, лично была, оно грязным. самой воде подойти не получится, установлено ограждение. хотя рассказывают, раньше разрешали принимать лечебные ванны. желания окунуться не возникло. равно провал - необычное место, обязательно стоит отправиться, находясь пятигорске. кстати, посещение плату не берут.возле входа установлена скульптура остапа бендера, сезон собираются многочисленные торговцы едой сувенирами, также предлагают пофотографироваться орлами, павлинами филинами.и заметку: открыт провал не круглосуточно (если не ошибаюсь, часов 19 вечера ежедневно, кроме понедельника). ", 11 мая 2017
60,9," красивый город неспешных прогулок пятигорске бывала несколько раз, каждый открываю что-то новое. обязательны посещения: гора машук (на вершину подняться канатке 350 рублей, пешком машине асфальтированному серпантину), озеро провал (на поглядеть сверху, вариант тех, более-менее приемлемой физической форме), парк цветник (с осмотром лермонтовских мест). собираетесь задержаться пятигорске больше, день, других интересных достопримечательностей. касательно минеральных источников: городе серо-водородные (хоть полезные, не вкусные плохо пахнущие). ваша цель набрать качестве сувениров близким минералки , рекомендую съездить этим соседние города.что касается времени путешествий: поздняя весна (когда цветет пахнет), осенью зимой все-таки серо, скользко, летом - жарко (прогуливаться придется гору, горы). хотя, конечно, любом времени года своя прелесть. ", 11 мая 2017
61,10," поездка кисловодск - это незабываемые впечатления, которые сочетают комфорт, спокойствие полноценный отдых душой телом! прошлом году новогодние праздники отдыхали кисловодске, мечтаем вернуться туда снова! атмосфера города великолепна, чистейший воздух, красивые достопримечательности, очень снежно мороз, примерно -10, вообще не чувствовался очень мягким, гулять никак не мешал. курортном парке очень красиво, деревьев, снега, начинается нарзанной галереи, оздоровите свой организм полезной водой, парке святой источник, поднимались самую вершину горы пешком парк, пути очень белок синиц - практически ручные, детям очень интересно покормить, самую высокую точку поднялись подъемнике, цены приемлемы, не 150 рублей человека, вид просто великолепный! захотите фирменных блюд адекватным ценам, советую заглянуть ресторан старый баку, это недалеко нарзанной галереи, уютная атмосфера, вкуснейшие осетинские пироги, лобио, хачапури вино, очень вкусно недорого, бутылка вина стоит среднем 500 рублей. пути курортный парк площади очень рынков павильонов сувенирами, обязательно нужно купить вкуснейшую пастилу, сушеную хурму, сыр - это фирменные продукты города, которые не оставят равнодушными! обычных продуктовых магазинах ассортимент цены стандартные, магазинов каждом шагу. отдых не оставит равнодушными! ", 05 января 2017
62,10," долина, которая щедро дарит красоту любое время года! судьба привела долину роз не самое удачное время (так подумалось вначале). гостила тетушки середине октября 2015 года городке лермонтов, рядом железноводском. кисловодск отправилась экскурсией, не ожидая многого розариев других цветников, явно не сезон. добравшись кисловодского национального парка (именно находится долина роз ), направилась бродить дорожкам, вооружившись картой парка.если вы, я, можете плутать трех соснах , не пренебрегайте картой. заблудиться нельзя, ряд интересных объектов остаться вне зоны прогулки, площадь парка около 1000 га. розы? удивительно, некоторые цвели, конечно, это не летнее буйство расцветок ароматов, фоне осеннего пейзажа выглядит поразительно. каменный крокодил, охраняющий, очарователен любое время года непременно атакован вашими детьми.если отправляетесь не организованной экскурсией, самостоятельно, парке хорошей погоде, провести целый день пользой здоровья: наслаждаясь чистейшим воздухом, выбрав терренкур (маршрут оздоровительной ходьбы) силам прихватив пару бутербродов, чувство голода не застало врасплох. же, отдыхает санатории орджоникидзе , немного завидую, могут любоваться красотой каждый день, моих силах, обязательно приеду сюда еще, будут цвести розы! ", 06 декабря 2016
63,8," причины любить пятигорск бываю замечательном уютном городке работе довольно часто, августе года удалось поехать туда отдохнуть.из плюсов могу отметить архитектуру: рука тянется достать фотоаппарат запечатлеть красоту память. особенно красив район цветника. старинные здания, аллеи, огромное количество цветов!много достопримечательностей: провалъ, грот лермонтова, домик-музей лермонтова, эолова арфа т.д. шикарный вид город, (а хорошую погоду эльбрус) открывается вершины горы машук.цены жилье терпимые. снимали квартиру районе цветника – отдали 14 тыс. рублей месяц. едой закупались, местные жители, супермаркетах. кафе могу посоветовать tree, вкусный кофе варят jazzve папа coffee.также посетили радоновые ванны. процедуры мелких воспалений лице спине убавилось. (или дело солнышке?!)кроме сходили кино, благо кинотеатр находился недалеко места нашего проживания. городе также театр оперетты, сожалению, туда не успели сходить.если надоест изучать город, воспользоваться шансом узнать кавказ получше. города организуют экскурсионные поездки приэльбрусье, домбай, архыз, кисловодск. цены поездки среднем 1 3-4 тыс. рублей.из транспорта – недорогое такси - пользовались услугами red taxi, также трамваи - 1 поездка 17 руб.минусов не много: во-первых, очень-очень жарко – духота стояла невообразимая. кроме того, городе велись строительные работы – меняли плитку тротуарах, строили ступеньки, немного некомфортно.в целом пребывание пятигорске понравилось. красивый старинный город, пропитанный историей, посмотреть заняться. ", 13 октября 2016
