,mark,review_text,date
46,7," поездка ставропольский край: тихий, провинциальный городок ессентуки шикарный кисловодск. рекомендую посещение именно таком порядке, ессентуки достаточно тихий, провинциальный городок. кисловодск современный, огромным национальным парком активной пешеходной зоной. отпуск занял 10 дней. добирались двухэтажном поезде 004/003. имейте ввиду поезде не кормят, туалетных принадлежностей не выдают. wi-fi смотреть страничке попутчик фильмы. первая остановка новом, современном пассаж. великолепное обслуживание персонал. прекрасная круглосуточная!!! столовая. вкусно недорого. расположен центре, рядом концертный комплекс им. ф. шаляпина, парк, грязелечебница им. н. а. семашко, корпус механотерапии, кафешки, магазин фанагория просковейские вина. входом парк экскурсионные палатки. рекомендую взять гида. наш гид сумел банальную обзорную экскурсию пятигорск сделать очень интересной познавательной (я не любитель обзорок). друзья ездили эльбрус, полном восторге. дальние поездки эльбрус грозный среду, воскресенье. медовые водопады не понравились, время убить . эльбрус не попали из-за погоды, кисловодска съездили долину нарзанов, прекрасно провели время, прошли тропу вдоль горной речки, заезжали смотровую площадку, поели вкусные чебуреки. друзья поездке эльбрус туда заезжали, скомкано быстро - попили водички дальше. экскурсии кисловодска дороже 300 р/чел. соответственно недолгие 14 18 - 700 руб./ 1000; эльбрус 6 утра 19 вечера 1500/1800; грозный 6 утра 23 вечера 2300/2600. сами ездили памятнику иисусу, приятное место прогулки (видимо входит обзорную ессентукам). национальный парк кисловодска колоннады (входа) ездят электромобили подъемника смотровую площадку. сами обошли пешком. ресторан ессентуках обошёлся 3600 руб. салата, горячее овощи гриль, бутылка вина, кофе. кисловодске 4600 руб. такси яндекс дешевое. ессентуков кисловодска 400 руб. кисловодске жили паркотель. самое большое преимущество отеля - это расположение прям национального парка всей жизни города. номер снимали пятом этаже. не стали переплачивать метры, поэтому очень маленький. номере чайник, халаты тапочки простенькие, гель, шампунь, мыло фен. завтраки входят сумму 200 р/чел., взять большую доплатить. время завтрака 8-11 утра. можете спросить ресепшн карту города парка. пассажа, конечно, очень скромно. да персонал какой-то не улыбчивый. целом, галочку поставили, кмв посетили. жалко не попали эльбрус. ", 08 мая 2021
47,10," пятигорск прекрасен, не заглядывать спальные районы... пятигорске сохранилась атмосфера имперского курорта. архитектурные изыски каждом шагу парки тоже. жили двух шагах пара цветник горы горячей, основном гуляли, пешком провала обратно дня. месте устаивало все, город большой выехать немного приделы нашего привычного района обитания выглядит довольно грустно. летом наверно это не сильно бросается глаза. зимой контраст сильный, спальных районах нет нормальных тротуаров.но, представить частью водяного сообщества , несколько моих фаворитов городе:кофейня гусокова парке цветник , которая очень похода пароход. очень приятно сидеть верхней палубе смаковать кофе ванильными булочками. булочки ничего, просто сладкая сдоба, самые вкусные городе.лермонтовская галерея голубых тонах кованным декором. прям дефиле кружевным зонтиком, кино, танцы!сабанеевские ванны (нынче пушкинские) - поразительная архитектура. нереальной красоты порталы изящными арками, вестибюль украшен орнаментальной живописью метлахской плиткой. жаль, не работают, воняют серные ванны, господа. жуть!))и еще, несмотря новое название, пушкин а.с. не был!подняться машук обязательно, красиво любое время года, туман очень атмосферно, вершине получите прогулку облаками возможность визуальнооценить величие эльбруса.по поводу провала, солидарна ильфом петровым — туристическая привлекательность малахитовой лужи сильно преувеличена. спасло полного разочарования факт, пришли рано утром, живописно стелился туман вокруг не души. царские времена озером мостик танцев водяного сообщества , туда спускалась корзина желающими побывать адской бездне . народе ходили легенды, ночам оттуда вылетает огнедышащее чудище губит людей почем зря. запах сероводорода действительно адский. провал огорожен, избежание стихийных несанкционированных купаний.в общем, будете многолюдной экскурсией, точно не поймете шарма места.эх, жаль, корзины отменили. ", 29 декабря 2020
48,8," спасибо пятигорск, не прощаюсь. пятигорске, небыла никогда. вообще, честно говоря, россии не планировала столько путешествовать, решил 2020 год)очень хотелось пеших конных прогулок, трекинга, минеральных вод горных речушек - это представляла поездку. поехала одна, женщина средних лет решила устроить мини отпуск, 3 дня активного отдыха пятигорске. поезда не жалую, да время тратить не хотелось, решено купить авиабилеты. пошла смотреть любимую палочку-выручалочку победу, бинго : 4500 руб, вылет любимого внуково, удобное время 12:00, прилет кавминводы 15:00. гостиницу брала тур агентстве, поэтому трансфер групповой. мерседесе универсале (я такие четыре дамы средних лет, желающих отдохнуть рутины) развезли отелям. дороге познакомились, договорились вместе сьездить экскурсию. агенстве посоветовали отель парк родник фабричной улице. сутки 3 800 это завтрках. расположение отличное, номера просторные чистые, заселили быстро раньше врмени, но! не посмотрела, отеле нет бассейна. территория очень приятная, вид город очень крутой, бассейн, нет... сама виновата, закинула своему турагенту удочку, точнее смс, что, завтра съехать оставшиеся 3 дня отель?утром, завтрака (к слову, завтрк очень вкусный богатый), ехала такси спа-отель хаят, который немого далековат центра, бассейн судя названию спа. мое переселение обошлось штрафов, спасибо девочкам агентсва. хаят очень милый, чистый отель. приятный персонал, вкусная кухня, диетическое меню. заселения ушла гулять город, вернее уехала такси, пешком идти далеко, машуку карабкаться, искать место дуэли лермонтова. стартовал маршрут ворот солнца, писали многие путеводители, брать немного правее, начинаются плоские плиты. подъема, выбрала начала попроще. шла лыжными палками, деле человек бывалый :)))) пол пути вершине смотровая площадка, лавочки. идти приятно, попутчиков много, познакомилась большим количеством интересных людей. машрут занимает прядка двух часов, неспешным шагом остановками. спускалась канатке, пешие спуски не люблю, силы решила пройтись кольцевым маршрутом подножъя машука. ждет сразу: место дуэли лермонтова, комсомольская поляна, провал, эолова арфа.поужинала городе, ресторане скотный двор, кухня очень простая приятная (а оруэл заморочился:). второй день поняла, болит тело (привет машука) последующие 2 дня проведу спа, бассейне спа. кстати, массажитка отеле очень хорошая, сеансов спала младенец. общем экскурсии не попала, читала брошюры отеле) знаю поеду второе свое пришествие, оно думаю очень скоро. спасибо пятигорск не прощаюсь. ", 26 августа 2020
49,8," кисловодск плюсы минусы добрый вечер дамы господа. хочу оставить отзыв г. кисловодск. останавливались гостевом доме люкс. город, природа, воздух, гостеприимство просто отличное. люди подскажут расскажут. парк времена года хорош своему. некоторые нюансы которых не встречал других городах россии.1. туалеты везде платные парке ладно платные ещё не очень чистые.2. очень странно просят наличные деньги, настоять вопросов нет примут карту. (я привык плотить помощи телефон очень удевлен) 3. завидениях живая музыка (а везде) дерут деньги музыкальное сопровождение. (в среднем 100 каждого человека). не жалко те поют скажем мягче петь не умеют кислыми лицами.но хочу повтарися отдых удался нам понравилась! оценка твёрдая 4 ", 30 ноября 2019
50,10," лучшие семейные выходные добрый день! недавно семьёй решили съездить медовые водопады. любим, путешествовать кавказу, природа завораживает, вот, дороге нам открылись такие красивые виды. луга просторы, не уступающие елисейским полям. поехать медовые водопады нам посоветовали друзья, которые бывали остались полном восторге. вот, знаете это действительно очень красивое место, водопады не слишком большие, несколько, разной высоты. вода полагается горных рек чистая, прозрачная. попали дождливую погоду, поэтому долго гулять водопадам нам не удалось. подножия находится замечательное кафе, смогли вкусно покушать полюбоваться прекрасными видами веранды. всё обустроено туристов судя нашей ситуации, бывают круглогодично хорошую, плохую погоду. какие продают вкусности! местные жители сами готовят чак-чак, хворост разными наполнителями, разного вида варенье, числе травами, мёд, ульи установлены неподалёку водопадов. также имеется тарзанка, она, называется, это любителей экстрима, прокатиться прям водопадами. сувенирные лавки избытке любой вкус цвет. забыла сказать, ещё находятся различные конные прогулки, очередь сделали, дети восторге. отдых удался, полюбовались красотами, покушали вкусной еды, накупили сувениров покатались лошадях. ", 20 сентября 2019
51,10," кисловодск — лучший курорт кмв среди городов кмв, еня кажется лучшим именно кисловодск. во-первых, лучший курортный парк терренкурами, широкий прогулочный бульвар, очень отдыхающих,во-вторых какой-то размеренно-расслабленный ритм всем этом. завсегдатаи-курортники оседают несколько недель — отдыхать оздоравливаться.приезжаешь кисловодск поезде (кстати, территории вокзала интересный музей ржд бесплатным входом), сразу встречает красавец куророртный бульвар. нарзанная галерея, колоннада, всё рядом. здания очень нарядные пряничные. заселения санаторий, решили прогуляться городскому парку. очень ухоженный, очень клумб, не парадные естественные, напоминают альпийские горки всюду величественные сосны.в парке очень уютное кафе, чайный домик . не зря кафе называется, ассортимент чаёв предлагается космический! выбор еды не большой, есть, суы, салаты, горячее. официанты, конечно, временами несколько нерасторопны, это простили. помимо прогулок городу лечения сана тории одна цель - косыгинская тропа. зайти тропу трем путям: 1. снизу терренкура, идя санатория орджоникидзе2. долины роз3. сверху спускаясь терренкуру верхней станции канатной дороги. первый третий маршрут пойдет часовой стрелке, второй против часовой-здесь личному восприятию. тропу, кстати, видно вагончика канатной дороги. не пропустить стороны терренкура, смотрите внимательно- терренкур начнет уходить влево красивых скал, вдоль обрыва правее пойдет широкая тропа - туда. лучшего ориентира недавно установлен указатель. ", 01 июля 2019
52,10," целебная вода ессентуков ессентуках весной впервые. отдыхала санатории. поездкой читала отзывов городе интернете. мои представления не совпали увиденным, хотя ессентуки мне, , понравились, оказалось другим - лучше, интереснее. например, другим оказалось расположение куротного парка. парк состоит двух частей.один низине, овраге, вверху ним. вверх ведут низины лестницы разных времен, тропинки. деревья парка основном лиственные. небольших строений дореволюционной поры: ротонды, беседки. отреставрированно, заброшено. своя прелесть. видно, стараются восстанавливать старину. интересны жилые дома центральной части города, которые видела недалеко парка. дома старые, 1-2 этажные, некоторые производят впечатление развалюшек. середина дома остатком старого купеческого особняка, датированного 1911 годом, нему сторон прилеплены деревянные ,покосившиеся ,верандочки. таких миксов старины 80-ми много. ещё городе большая курортная зона, находятся основном санатории, 29, не считая гостиниц. движение машин дорогам ограничено. знаменитое здание грязелечебницы, практичести символ города, старинных апартаментах приличную плату принять натуральные минеральные ванны, грязи изобилие ещё ряд процедур. торговая развлекательная жизнь бьет вокруг центральной площади города. очень понравилось кафе солохи , район площади. повар любит своё дело. заказали 4 блюда, отменно вкусными. люблю кофе десерты, многих кофейнях. отмечу кафетерий миндаль , вернее это кондитерский бутик, гоголя 6, улица универмагом, площади. тихо, очень чисто, уютный интерьер мягкими креслами, десерты вкусные, кофе тоже. впервые этих краях, съездила обзорные экскурсии ближайшим городам. почему пришелся душе железноводск. хотя пятигорск очень интересный кисловодск хорош. съездила водопады. сказать, водопады неплохи, экскурсиях мало, людей, страждущих увидеть, (автобусов 8 привозят), добавьте ещё навязчивую мишуру кабардинских чайных домиков, торговые ряды, катания лошадях, фото орлами прочее, хотя это кого-то развлекает. экскурсионных фирм много, идентичны, ездили тремя, разницы никакой. 6 экскурсий попалась женщина, рассказывающая вдохновением, талантливый экскурсовод. звали евгения, лет 50 ей. это человек, влюбленный не свой край, людей. ещё съездила станицу суворовскую купаться бассейнах термальными (они минеральные) водами. это недалеко ессентуков, 20 минут маршруткой (101 жд вокзала). личному опыту советую идти не бассейн, брать личную ванну. цена одна-350 р. прием ванн гораздо гигиеничние, общий бассейн ( воду естественно не хлорируют). вода очень действенная, одного раза стало больному колену. кстати цена натуральной минеральной ванны грязелечебнице стоит 660 рублей. поэтому людям выгоднее ездить суворовскую лечебными ваннами. ещё ессентуках понравился парк победы. гуляли территории санатория виктория. пионерское детство вернулась, антураж тех лет абсолютный, приятно пройтись. конечно, самое главное туда едут, это целебная вода. люди успешно лечат проблемы желудка, поджелудочной, стабилизируют диабет. пила предписанию врача жкт воду ессентуки 4 новую теплом виде. вкус нравилась ессентуки -4. источнике людей, сезон. санаторий апреле забит полностью, неожиданно, оказалось сезон марта. воду ессентуки -17 источника врачи считают очень агрессивной из-за сильной минерализации, поэтому редко кому советуют. источнике №17 самое малое количество людей, 5-6 человек. бювет красивый, мавританском стиле. исторический. очень вкусный воздух тех краях, видимо из-за предгорий, говорят ионизированный, полезный. ", 18 мая 2019
