,mark,review_text,date
0,4," как-то 50 50. 50% природа + 50% администрация -! санаторий лермонтов путевке нахожусь сейчас. се вроде ничего. питание, летнем пионерском лагере помню. но, не задача, не пойдешь нет одного магазина, аптеки, парикмахерской, туалета, это конечно, где-то есть, где? загадка! ходить гору, гору, горы, гору! удобства нужны! общественный транспорт отсутствует таковой, есть, конечно, трамвай, хотите окунуться 60-е годы, сюда. бестолково спланировать социальные услуги населению, мер курсе такого нигде ничего! ",07 марта 2023
1,9," питание пятигорске отдыхали 2 дня. жили отеле машук номере стандарт. отель весьма скромный, расположен очень удобно. рядом. ходили везде пешком. хотела поделиться насчет питания. самом отеле столовая, очень обычная. завтрак 430 рублей не стоит. еда, столовой. последний день нашли очень милое кафе: скромное, очень вкусно не дорого. кафе называется ретро . фото меню выставляю. выбор небольшой, еда очень вкусная. находится около верхнего рынка: ул. крайнего 30. остальных кафе дороже будьте внимательнее меню цены не порцию, 100 гр. ",19 февраля 2023
2,4," не понравился город! кисловодске провели июль-август 2022г.жили а.губина.поразило то,что подъездах не убирают,нет дворника,мусорные баки дранные старые,мусор вываливается землю летает всей окрестности.январь 2023 г-живем азербайджанской ул.нет слов,чтобы описать это грязное гетто домов.везде грязь,покареженный асфальт,мусор,разбитые остановки.после 19-и часов никуда не уедешь,маршрутки исчезают.нет освещения столбах.в подъездпх не убирают,соседи выставляю мусор лестничную клетку идёшь вонь квартиру!никто не штрафует!мы просто ужасе!мэр города видимо не проезжал-не царское это дело!вылизывают центр,на остальные районы просто забили.думали приобрести жильё -передумали.тут нет законов порядка!!! ",09 января 2023
3,10," отлично! заказывал тур жене. поскольку урале также обьездили горы ниве, это знакомо не страшно) очень понравилось, довольная, перепады высот, конечно, разы больше. спасибо! здорово! ",06 декабря 2022
4,1," решайте проблему собаками, каждым годом больше!!! всё хорошо, спасибо развели собак, стаи бегают городу гавкают, очень не приятно гулять ",04 ноября 2022
5,10," очень понравилось красивое место, приятный уютный ресторан живой музыкой. рядом замком стоит лошадка, покататься, также хозяин лошадки проводит очень интересную экскурсию истории замка водит окрестностям, показывая красивые необычные места. рекомендую. ",26 сентября 2022
6,10," кисловодск-ван лав! отдыхали кисловодске сентябре 2022, ранее не бывали, честно, выбор кисловодск пал исключительно из-за закрытых границ. каково оказалось наше удивление, местные красоты намного ярче, красивее любых зарубежных аналогов! да, сервис необходимо подтягивать, красоты природы компенсируют недостатки!!! объехали достопримечательностей округе, хочется сказать огромное спасибо ребятам проката, всё очень достойно- доставили авто прямо отелю, авто абсолютно новое, всё договору. особенно поразило джилы су, приэльбрусье, домбай, архыз верхняя балкария. общем впечатлений целый год! обязательно вернемся кисловодск еще, рекомендую!!! ",19 сентября 2022
7,1," позор сотрудникам дпс пятигорска весь отдых омрачен поведением сотрудников полиции гибдд, приехали экскурсию пятигорск, попали очень не приятную ситуацию, нашу автомашин эвакуировали штраф стоянку, неё отошли, сработала сигнализация ключах, подошли информацией сотрудникам дпс, узнать забрали машину, аможет её украли, не стали разговаривать, не подсказали обратится помощью, здоровых амбала, отвернулись просьбу помощи никак не отреагировали. доблестные сотрудники дпс!!!!!!! позор, такого отношения людям нигде не встречала. ",25 августа 2022
8,1," опасно здоровья прибыв ночью минеральные горы первые часа чудом не пострадали. город кишит бродячими собками. окружают одиноких людей парах, лая разбигаясь любой машины. пытались остановить редко проезжающие автомобили, человек не остановился(номера местные, люди гостеприимные, хотят что-то получить,например таксисты). кармане сникерс, удалось отвлечь внимание время добраться ближайшего открытого здания. спасибо шоколадке. стаи бродячих собак оставляют незабываемые впечатления. хотите пощикотать нервы остаться колекой, места не найти. ",25 августа 2022
9,2," не ездите пятигорск автомобиле собираетесь автомобиле, хорошенько вспомните правила парковки. будучи там, не теряйте бдительности тщательно осматривайте место парковки предмет знаков, близости пешеходных переходов, линий разметки прочего. то, кругом стоят другие а/м, не повод расслабляться. хренова туча эвакуаторов, постоянно снуют вместе дпс-никами. причём нарушение правил парковки, рядом машиной, будут крутиться встанут неподалеку, дождаться вашего отсутствия. местные называют воры законе . штраф платите государству, 2750 увоз - руки. причем штрафстоянке легко провести жаре улице весь день, пускают шлагбаум одному, оформляют спешки бегают окрестным заправкам магазинам, нет сдачи. просят переводит телефон, именно месте интернет не работает. ",14 июля 2022
10,2," толпы, очереди, отсутствие порядка, аэропорт явно не рассчитан большое количество человек ",04 июля 2022
11,10," прекрасное место! кисловодск просто идеальное место, спокойно отдохнуть поправить свое состояние физическое, ментальное. ездила подругой, достопримечательности обошли объездили, заведениях/музеях побывали. погода время чудесная, люди приветливы, еда вкусна! отдельно отмечу воду кисловодская целебная – оказалась действительно полезной. многое узнали ней, пока были, пили естественно постоянно. проблемах жкт идеальна. ",22 июня 2022
12,4," необходимо приобрести багажные каталки здравствуйте! ворота кмв! сегодня очень стыдно наш красивейший аэропорт. сегодня столкнулась проблемой , прилетели, ждем багаж, проплачена привезена доп тяжелая сумка. увы… носильщика, собственно нужна просто багажная каталка, багажном терминале нет. это встречаем гостей курорта? бегают -ищут. стыдоба. пропишу сайтах, написать отзыаы. дёшево… противно. женщины волокут детей, чемоданы. ",20 сентября 2021
13,2," жизнь воды всем привет! приехали гости родственникам пос. пятигорский , это ужас, люди посёлке живут воды, совсем. живем второй месяц. помыться помыть посуду, постирать, воды нет днём вечером утром. это просто средневековый 🏰 век, живут бедные люди.я полнейшем шоке, искать какое место баню поехать помыться. администрация руководство пятигорска смотрит! никаких мер не предпринимается.туристы коем случае не приезжайте сюда, не сможете элементарно помыться. ",27 июня 2021
14,4, детьми коляске гулять кисловодске? детьми коляске гулять кисловодске? никак! инвалидам более. ,27 ноября 2020
15,3," очень портит отдых пребывание железногорске гремящая музыка парке озера. невозможно комнате открыть окно, не слышать бум-бум- бум.. ",03 октября 2020
16,4," выехать аэропорта холле аэровокзала стоит стойка м надписью такси проезд г железноводск составил 850 руб ,в время яндекс такси стоит 350 руб .что нелигалы аропорту ",10 июля 2020
17,9, выбирайтесь дома любую погоду почаще) гора кольцо находится боргустанском хребте.там интересных мест.вот вариантов прогулки боргустанскому хребту горой кольцо. ,23 января 2020
18,10, выбирайтесь дому почаще) монастырь интересен сама гора. вариантов день провести захватом монастыря горы. ,23 января 2020
19,8," прекрасно, приездом читайте отзывы, точно посетить прекрасно отдохнули, взяли женой отпуск отправились кататься кмв. посетили города, которые хотели, останавливались мин водах , самое дешевое жилье. машину брали прокат мин-водах, удобно добираться аэропорта. вышло дешево, брали автостиле.всего провели кмв 10 дней. это время сбросили весе, наладили свое питание, посетили пятигорск, кисловодск, ессентуки железноводск. жаль, заранее не стали читать отзывы курорте, нашли гораздо мест, посетили. следующем году наверстаем упущенное. не тратьте время деньги моря, езжайте оздоравливаться! читайте заранее отзывы! ",16 декабря 2019
20,2," шаляпин умер 1938г дешевая легенда. открылся конце 40х. говорят, однажды нем обедал федор шаляпин шаляпин умер 1938г. париже, плевать хотел ваш большевистский пятигорск.владельцам нужно уволить маркетолога распространил такую ересь. ",17 октября 2019
21,10," не морочить людям голову негативными отзывами! вернулись сыном иноземцева (санаторий машук аква-терм) - полном восторге. отзывы нём старые не соответствуют действительности. посмотрите свежие рейтинги убедитесь, пишут неправду! самим съездить убедиться, санаторий классный. просто не напраслину объект возводить. г. железноводск последние годы просто расцвёл (центр 100%) -мы приятно удивлены (по сравнению пятигорском просто земля небо ). 4-ый ( перерывами) отдыхаем северном кавказе, поэтому видим изменения лучшую, худшую сторону. ",29 августа 2019
22,10," кисловодск... добрый вечер, хочу оставить свой отзыв отдыхе раз, кисловодске бываем часто, нам очень нравится там, такая природа 2 часах нас, раньше бабушка жила, останавливались конечно, приходится гостиницах. вот, нам очень повезло снять дом, 2 этажный, недорого. хозяин очень доброжелательный, дом чистый, новый, наверху 3 спальни, внизу гостиная кухня, посуда, мангал, замечательная терраса прекрасным видом кисловодск, вокруг такая природа (дом стоит горе), хозяин дал номер такси, 100 руб. съездили коллонаду, парке погулять. дети ( младший налазился горам вдоволь, просится ) очень довольны, будем останавливаться!!! ",12 марта 2019
23,8," минеральные воды -хорошо полезно. дорогие друзья,краткое описание посещения города ессентуки,города кмв очень романтичны,а ессентуки запомнился очень солнечным,праздничным.добрым,хотелось предупредить посещающих ставропольский край,о известной фирме sdaldom/kvartiraвсе: кассирша авиакассах, турагент,девушки нарзанных галереях, экскурсоводы,владельцы квартир вежливыми отзывчивыми,а эта фирма обманула.будьте бдительны. удачи всем путешествиях. ",11 сентября 2018
24,1," комментарий! это видеть, кошмар, не аэропорт. ",18 декабря 2017
25,5," это не аэропорт, ужас! это не аэропорт, ужас! заслуживают двойку плюсом. зал прилета не оборудован, выходе кавказские таксисты не затаскивают машины. ",18 декабря 2017
26,10," поездка майские ессентуки ессентуки мае очень уютен несуетлив. приезжаешь сюда , время останавливается, вокруг нет той городской суеты , которая присутствует больших мегаполисах , нет шума проезжающих машин, вокруг тишина спокойствие. ессентуки поражает архитектурой , сохранившейся советской эпохи, попадая город , ощущаешь оказался прошлом , попал семидесятые года прошлого века! город красив не архитектурой , период весеннего цветения вокруг благоухает- цветут цветы клумбах, цветут всевозможные кустарники деревья -каштаны вишни , сакурагуляя уютным тихим улочкам города , заблудится невозможно(даже очень сильно захочешь). дороги приведут городскому вокзалу городе всевозможные питьевые галереи минеральными источниками (которые кстати говоря, работают строго расписанию)в хорошую погоду окна нашего номера отеле, находящегося 3 этаже виден эльбрус ",05 декабря 2017
27,10," тихое уютное великолепие ессентуков ессентуки необычайно спокойный тихий курортный город. старинная архитектура красивые парки , множество питьевых галерей минеральными источниками . тихий несуетливый город чистые ухоженные улочки , заблудится которых невозможно! находишься городе видишь вокруг цветущие клумбы кустарники , улыбающихся отдыхающих, становится светло тепло душе . каждый побывал небольшом городке мечтает оказаться уютном тихом городе, подальше суеты огромных мегаполисов! ",05 декабря 2017
28,10," не место красит человека , человек место сестрой ехали транзитом,через минеральные воды.были сутки вокзале.пришлось остановиться комнате длительного отдыха жд вокзале.поразило обслуживание . приняла дежурная емельяненко ольга александровна .вот действительно человек своем месте.пока устраивали номер нам предложены короткие экскурсии кисловодску,мин.водам.ольга александровна любовью говорила местах, которые посетить ,что не смогли удержаться прекрасно провели время.мало обратного пути опаздывали автобус поезда.ольга александровна нашла вокзал которого должны уехать договорилась работниками вокзала.нас ждал четыре дня автобус вокзале,20 минут,пока не добрались такси. поезда.мне очень жаль не сохранила фото ольги александровны.очень хотелось увидели сколько просто доброты человека. ",07 октября 2017
29,10," замечательно! кисловодск прекрасный город. чистый, ухоженный, замечательным парком, очень интересными окрестностями, целебной водой, доброжелательными жителями вкусной едой. хороших гостиниц (мы останавливались короне очень довольны) кафе ( нам понравилось городе старый баку, парке чайный домик сосновой горе). главная достопримечательность - парк: зелень, цветы, дорожки, изумительный воздух. ",26 августа 2017
30,2," плохое место экскурсий ито не люблю матом всем привет. не советую это место хочет поехать туда посмотреть достопримечательности, нету, никуда не пустят, посмотреть фотки интернете 1000 красочнее наяву, максимум будете улице ещё не каждый столик пустят. вобщем не злой человек, там, довели. ",22 августа 2017
31,10," колосе здороаья прибавят, настроение улучшится! спасибо коллективу санатория колос доброту внимателтное отношение отдыхающим! колос 1 это уголок уюта, спокойствия искренних улыбок! всем советуем родственникам, друзьям. ",23 марта 2017
32,10," прекрасная осень кисловодске! вернулись кисловодска. cпасибо коллективу санатория колос прекрасный отдых лечение. получили массу изумительных впечатлений. лечение питание отлично, номера чистые, вовремя убирается. отдельное спасибо нашим официанткам поварам. массажист - мастер высокого класса. ходили пить минеральную воду нарзанную галерею - находится рядом санаторием. одним словом - нам очень понравилось. хотим сказать большое спасибо девочкам, занимается экскурсиями. посетили красивейших мест. замечательно, услуги территории санатория. спасибо!так держать! ",20 октября 2016
33,10," чудесное место лечения отдыха отдыхала солнечном сентябре 2015 года. очень понравилось, не хорошоотдохнула, поправила здоровье. главное лечение оно замечательное, водные процедуры, различные ванны, грязи, массаж, ингаляции, гинекологические процедуры, физио процедуры, консультации ведение узкими специалистами, питьевое лечение, посещение бассейна многое другое. процедуры входят стоимость путевки, спа процедуры – обертывание, косметолог, сауна некоторые развлечение - боулинг, бильярд оплачивать дополнительно. ",10 мая 2016
